{
  "event_rate_per_m3_s": {
    "d_he3": [
      25000000.0,
      35000000000.0,
      16750000000000.0,
      575000000000000.0,
      9500000000000000.0,
      1.35e+17,
      4e+17,
      6e+17,
      5.75e+17,
      4.5e+17
    ],
    "dd_total": [
      750000000000.0,
      27000000000000.0,
      900000000000000.0,
      6000000000000000.0,
      2.6e+16,
      1.05e+17,
      2.25e+17,
      4.4e+17,
      9e+17,
      1.1e+18
    ],
    "dt": [
      13750000000000.0,
      650000000000000.0,
      3.25e+16,
      2.75e+17,
      1.05e+18,
      2.175e+18,
      2.125e+18,
      1.575e+18,
      9.25e+17,
      6.75e+17
    ]
  },
  "mixtures": {
    "d_he3": {
      "first_density_m3": 5e+19,
      "first_species": "D",
      "second_density_m3": 5e+19,
      "second_species": "He3"
    },
    "dd_total": {
      "first_density_m3": 1e+20,
      "first_species": "D",
      "second_density_m3": 1e+20,
      "second_species": "D"
    },
    "dt": {
      "first_density_m3": 5e+19,
      "first_species": "D",
      "second_density_m3": 5e+19,
      "second_species": "T"
    }
  },
  "pack_version": "1.0.0",
  "reactivity_m3_s": {
    "d_he3": [
      1e-32,
      1.4e-29,
      6.7e-27,
      2.3e-25,
      3.8e-24,
      5.4e-23,
      1.6e-22,
      2.4e-22,
      2.3e-22,
      1.8e-22
    ],
    "dd_total": [
      1.5e-28,
      5.4e-27,
      1.8e-25,
      1.2e-24,
      5.2e-24,
      2.1e-23,
      4.5e-23,
      8.8e-23,
      1.8e-22,
      2.2e-22
    ],
    "dt": [
      5.5e-27,
      2.6e-25,
      1.3e-23,
      1.1e-22,
      4.2e-22,
      8.7e-22,
      8.5e-22,
      6.3e-22,
      3.7e-22,
      2.7e-22
    ]
  },
  "schema": "pvs-fusion-reactivity-values/1",
  "temperature_keV": [
    1.0,
    2.0,
    5.0,
    10.0,
    20.0,
    50.0,
    100.0,
    200.0,
    500.0,
    1000.0
  ]
}
